onset	duration	Experiment - Satz_B1	Serial_no	Code	Stimulus	Condition	Onset_time	response	response_time	Accuracy	Bildh	Arousal	EmoVal	Gebr	Metaph	Buchstaben	WÌ¦rter	Similarity	NebensÌ_tze	Relative	Passiv	Komposita	Personen	Angaben	Konjunktive	analytF	Satzstellung
1,63	4	44OG	1	12	Immer wenn der Berg rief, stand er sehr frŸh auf.	99	1630	keine	0	keine	99	99	99	99	99	99	99	99	99	99	99	99	99	99	99	99	99
6,665	4	44OG	2	21	Tanja wŸnschte sich ein Pony zum Geburtstag.	99	6665	keine	0	keine	99	99	99	99	99	99	99	99	99	99	99	99	99	99	99	99	99
11,704	4	44OG	3	262	Dieser Mann ist echt hŸbsch.	2	11704	keine	0	keine	5	4	2	5,454545	1,181818	23	5	6,181818	0	0	1	0	2	1	0	0	0
16,745	4	44OG	4	201	Ach, was fŸr ein einfaches Leben hatten wir wŠhrend der Schulferien!	2	16745	keine	0	keine	4,33	2,2	0,2	4,63	1,37	58	11	5,736842	0	0	0	1	1	1	0	0	1
22,784	4	44OG	5	103	Das GesprŠch beim Finanzamt verlief glŸcklicherweise reibungslos.	1	22784	keine	0	keine	3,39	4,25	-0,7	4,26	2,53	59	7	6,210526	0	0	0	1	1	2	0	0	0
27,818	4	44OG	6	204	Das war eine unglaublich gleichgŸltige Reaktion von ihr.	2	27818	keine	0	keine	3,44	4	1,7	5,26	1,74	49	8	3,315789	0	0	0	1	1	2	0	0	0
35,858	4	44OG	7	308	### ###### ### ########## ### ##########	3	35858	keine	0	keine	99	99	99	99	99	99	99	99	99	99	99	99	99	99	99	99	99
42,898	4	44OG	8	146	Nach dem MissverstŠndnis war Irma jetzt in einer haarigen Situation.	1	42898	keine	0	keine	3,5	4,7	-1,7	5,32	3,58	59	10	5,894737	0	0	0	1	1	2	0	0	0
50,944	4	44OG	9	113	Der vorbestrafte Mann war diesmal sauber.	1	50944	keine	0	keine	2,83	5	1,8	4	4,63	36	6	6,052632	0	0	0	1	1	1	0	0	0
55,984	4	44OG	10	360	##### ###### ##### ##### ######### ### ###### #### #####	3	55984	keine	0	keine	99	99	99	99	99	99	99	99	99	99	99	99	99	99	99	99	99
62,024	4	44OG	11	212	Das Thema des Matheunterrichts ist schwierig.	2	62024	keine	0	keine	3	4,15	-0,3	4,05	1,95	40	6	5,315789	0	0	0	1	1	1	0	0	0
67,059	4	44OG	12	159	Linda war nervšs, aber die PrŠsentation lief absolut glatt.	1	67059	keine	0	keine	4,22	3,65	1,5	5,16	4,74	51	9	5,947368	1	0	0	0	1	1	0	0	0
73,098	4	44OG	13	334	#### ########### ############## ###### ### ##### ####	3	73098	keine	0	keine	99	99	99	99	99	99	99	99	99	99	99	99	99	99	99	99	99
81,133	4	44OG	14	249	Seine empfindliche Seele konnte den Streit nicht lŠnger aushalten.	2	81133	keine	0	keine	4,5	2,65	1,3	4,21	1,79	58	9	5,842105	0	0	0	0	1	1	0	1	0
86,173	4	44OG	15	257	Utes neue Kaffeemaschine hatte eine einfache Bedienung.	2	86173	keine	0	keine	3,89	4,7	0,6	5,16	2,21	49	7	4,736842	0	0	0	1	1	0	0	0	0
94,213	4	44OG	16	319	### ###### ####### ###### ##### ####### ########### ######	3	94213	keine	0	keine	99	99	99	99	99	99	99	99	99	99	99	99	99	99	99	99	99
105,253	6	44OG	17	401	Hast du eben Rautezeichen gesehen?	4	105253	keine	0	keine	99	99	99	99	99	99	99	99	99	99	99	99	99	99	99	99	99
114,3	4	44OG	18	239	Laut und unangenehm hallten die Stimmen der HŠndler auf dem Markt.	2	114300	keine	0	keine	4,89	2,25	0,4	4,26	2,68	56	11	4,157895	0	0	0	0	1	2	0	0	1
122,346	4	44OG	19	231	Es gibt gute Argumente fŸr Baumwolle statt Polyester.	2	122346	keine	0	keine	2,67	3,85	1,4	5,05	1,63	46	8	6	0	0	0	0	1	0	0	0	0
127,386	4	44OG	20	326	###### ####### ######### #### ### ################# ## #########	3	127386	keine	0	keine	99	99	99	99	99	99	99	99	99	99	99	99	99	99	99	99	99
132,426	4	44OG	21	147	Nur sehr helle Kinder machen bei diesem Wettbewerb mit.	1	132426	keine	0	keine	3,28	4,35	1,5	4,68	2,21	47	9	5,368421	0	0	0	1	1	2	0	0	0
138,466	4	44OG	22	359	###### ### ###### #### ### ########## ### ####### #######	3	138466	keine	0	keine	99	99	99	99	99	99	99	99	99	99	99	99	99	99	99	99	99
144,5	4	44OG	23	143	Meine Gro§eltern hatten ein wirklich hartes Leben.	1	144500	keine	0	keine	3,94	2,55	0,9	4,21	2,53	44	7	6,222222	0	0	0	1	1	1	0	0	0
155,535	4	44OG	24	226	Diesen Sonntag streiten sich die Kanzlerkandidaten im Fernsehen.	2	155535	keine	0	keine	4,17	5,05	-1,8	4,74	1,95	57	8	5,111111	0	0	0	1	1	2	0	0	0
161,576	4	44OG	25	119	Die kleine Familie wollte ihren Hausbau vorausschauend planen.	1	161576	keine	0	keine	3,22	3,45	0,6	3,63	4,89	55	8	5,833333	0	0	0	1	1	1	0	1	0
170,61	4	44OG	26	346	#### ### ############### ### #### ##### ## ##### ######### #########	3	170610	keine	0	keine	99	99	99	99	99	99	99	99	99	99	99	99	99	99	99	99	99
180,645	4	44OG	27	330	####### ### ######## ######## ### ###########	3	180645	keine	0	keine	99	99	99	99	99	99	99	99	99	99	99	99	99	99	99	99	99
185,692	4	44OG	28	230	Endlich war Ruhe zwischen den Streitenden.	2	185692	keine	0	keine	4	2,2	0,7	4,95	1,32	37	6	4,578947	0	0	0	1	1	1	0	0	0
190,731	6	44OG	29	402	Hat der Streit aufgehšrt?	4	190731	keine	0	keine	99	99	99	99	99	99	99	99	99	99	99	99	99	99	99	99	99
202,76	4	44OG	30	154	WŸtend schaltete der LangschlŠfer den dummen Wecker aus.	1	202760	keine	0	keine	5,89	3,9	1,2	5,26	3,58	49	8	5,263158	0	0	0	1	1	1	0	0	0
208,807	4	44OG	31	117	Die Firma hat sich einen finanziell gut aufgestellten Partner ausgesucht.	1	208807	keine	0	keine	2,94	4,25	0,8	4,58	2,79	64	10	5,789474	0	0	0	0	1	1	0	1	0
213,841	4	44OG	32	362	###### #### ### #### ######	3	213841	keine	0	keine	99	99	99	99	99	99	99	99	99	99	99	99	99	99	99	99	99
219,881	4	44OG	33	305	### ### ##### #### ###### ############ ### ###### #####	3	219881	keine	0	keine	99	99	99	99	99	99	99	99	99	99	99	99	99	99	99	99	99
229,916	4	44OG	34	301	### ### ### ### ######## ##### ###### ### ####### ### ###########	3	229916	keine	0	keine	99	99	99	99	99	99	99	99	99	99	99	99	99	99	99	99	99
238,962	4	44OG	35	222	Die Unternehmerin war immer in Eile.	2	238962	keine	0	keine	4,67	3,25	-0,3	5,26	1,79	31	6	4,157895	0	0	0	0	1	1	0	0	0
246,997	4	44OG	36	339	#### ### ########### ######### ### ####### ### ######### #### ### #####	3	246997	keine	0	keine	99	99	99	99	99	99	99	99	99	99	99	99	99	99	99	99	99
255,037	4	44OG	37	108	Der Gesang des Opernstars ist kšstlich.	1	255037	keine	0	keine	4,78	4,05	-0,4	4	4,74	34	6	5,5	0	0	0	1	1	1	0	0	0
261,078	4	44OG	38	237	In Wien habe ich einen sehr leckeren Kaffee getrunken.	2	261078	keine	0	keine	5,72	5,1	-1,7	4,53	2	46	9	6,263158	0	0	0	0	1	1	0	0	0
271,112	4	44OG	39	350	######## ########## ##### ############ #### ## ######	3	271112	keine	0	keine	99	99	99	99	99	99	99	99	99	99	99	99	99	99	99	99	99
282,158	4	44OG	40	310	### ############ ##### ### #### #### ######### #######	3	282158	keine	0	keine	99	99	99	99	99	99	99	99	99	99	99	99	99	99	99	99	99
293,199	6	44OG	41	403	Hast du gerade Rautenzeichen gesehen?	4	293199	Ja	4823	correct	99	99	99	99	99	99	99	99	99	99	99	99	99	99	99	99	99
302,23	4	44OG	42	144	Meine Tante hat ein weiches Herz, sie kocht freiwillig fŸr Obdachlose.	1	302230	keine	0	keine	5,5	3,2	1,1	4,83	2,84	60	11	5,578947	1	0	0	1	2	1	0	0	0
311,275	6	44OG	43	404	Ist die Tante nett zu armen Menschen?	4	311275	keine	0	keine	99	99	99	99	99	99	99	99	99	99	99	99	99	99	99	99	99
318,317	4	44OG	44	354	###### ######### ### ############ ### ####### ###### ###	3	318317	keine	0	keine	99	99	99	99	99	99	99	99	99	99	99	99	99	99	99	99	99
325,356	4	44OG	45	134	Ihre romantische Hochzeitsfeier bewegte die Braut sehr.	1	325356	keine	0	keine	5,11	4,15	-0,8	3,68	5,42	49	7	4,421053	0	0	0	1	1	1	0	0	0
335,402	4	44OG	46	148	Seine Hoffnungen auf Gesundheit hatte der Kranke lŠngst begraben.	1	335402	keine	0	keine	4,44	3,65	-0,2	4,95	3,89	57	9	6,736842	0	0	0	0	1	1	0	1	1
340,449	4	44OG	47	118	Die GesprŠche Ÿber seine Kindheit waren schmerzhaft fŸr ihn.	1	340449	keine	0	keine	4,22	3,65	-0,1	5	4,63	52	9	5,315789	0	0	0	0	1	1	0	0	0
350,488	4	44OG	48	205	Das war heute eine gro§e EnttŠuschung fŸr meinen Vater.	2	350488	keine	0	keine	3,61	4,3	1,8	4,53	2,37	47	9	6,105263	0	0	0	0	1	1	0	0	0
358,535	4	44OG	49	349	##### ############ ##### ###### ### ###### ##### ###### #########	3	358535	keine	0	keine	99	99	99	99	99	99	99	99	99	99	99	99	99	99	99	99	99
365,575	4	44OG	50	260	Ursula wollte alles vergessen und reiste nach Japan.	2	365575	keine	0	keine	3,89	5,25	-2,1	4,58	2,53	45	8	4,368421	1	0	0	0	1	0	0	0	0
371,621	4	44OG	51	150	Vokabeln verankern sich durch regelmŠ§iges †ben im Gehirn.	1	371621	keine	0	keine	3,33	3,8	1,4	5,05	3,63	51	8	6,263158	0	0	0	0	1	1	0	0	0
378,655	6	44OG	52	405	Ging es gerade ums Lernen?	4	378655	keine	0	keine	99	99	99	99	99	99	99	99	99	99	99	99	99	99	99	99	99
385,69	4	44OG	53	207	Der Flugbegleiter heute war wirklich attraktiv!	2	385690	keine	0	keine	5,18	5,5	-0,6	3,84	3,53	42	6	6,526316	0	0	0	1	1	2	0	0	0
390,73	4	44OG	54	211	Der Sieg des LŠufers erzeugte riesige Medienaufmerksamkeit.	2	390730	keine	0	keine	4,59	4,2	-0,5	4,63	1,89	53	7	6,111111	0	0	0	1	1	1	0	0	0
401,77	4	44OG	55	110	Der Schauspieler hatte ein zerfurchtes Gesicht voller Narben.	1	401770	keine	0	keine	6,53	3,65	0,7	5,16	3,26	54	8	5,947368	0	0	0	1	1	1	0	0	0

